{
  "recipeVersion": "1",
  "componentId": "thinking-indicator",
  "variantAxes": [
    {
      "name": "state",
      "values": ["streaming", "expanded", "collapsed", "duration"]
    }
  ],
  "defaults": {
    "variants": {
      "state": "collapsed"
    },
    "state": "rest"
  },
  "slots": {
    "trigger": {
      "color": "{semantic.color.text.secondary}"
    },
    "icon": {
      "color": "{semantic.color.text.secondary}"
    },
    "content": {
      "color": "{semantic.color.text.secondary}"
    }
  },
  "states": {
    "rest": {
      "trigger": {
        "color": "{semantic.color.text.secondary}"
      }
    },
    "hover": {
      "trigger": {
        "color": "{semantic.color.text.primary}"
      }
    },
    "focus": {
      "trigger": {
        "outline": "{semantic.color.text.ai}"
      }
    },
    "disabled": {
      "trigger": {
        "color": "{semantic.color.text.tertiary}"
      }
    }
  },
  "fallbacks": {
    "missingVariantBehavior": "use-defaults",
    "stateFallbacks": {
      "hover": "rest",
      "focus": "rest",
      "disabled": "rest"
    }
  }
}
